question_number,question_text,question_length,option1,option1_length,option2,option2_length,option3,option3_length,option4,option4_length,option_count,correct_answer_numbers,correct_answer_text,required,keyword,image,short_last_option
175,"Việc sản xuất, sử dụng, mua, bán trái phép biển số xe có bị nghiêm cấm hay không?",81,Không bị nghiêm cấm.,20,Bị nghiêm cấm.,14,Bị nghiêm cấm tuỳ trường hợp.,29,,0,3,2,Bị nghiêm cấm.,False,biển,False,False
176,Khi gặp hiệu lệnh điều khiển của Cảnh sát giao thông như hình dưới đây thì người tham gia giao thông đường bộ phải đi như thế nào là đúng quy tắc giao thông?,157,"Người tham gia giao thông đường bộ ở phía sau Cảnh sát giao thông được đi, các hướng khác phải dừng lại.",104,Người tham gia giao thông đường bộ được rẽ phải theo chiều mũi tên màu xanh ở bục Cảnh sát giao thông.,102,"Người tham gia giao thông đường bộ ở tất cả các hướng phải dừng lại, trừ các xe đã ở trong khu vực giao nhau.",109,"Người tham gia giao thông đường bộ ở phía trước Cảnh sát giao thông phải dừng lại, các hướng khác được đi.",106,4,3,"Người tham gia giao thông đường bộ ở tất cả các hướng phải dừng lại, trừ các xe đã ở trong khu vực giao nhau.",False,giao thông,False,False
177,Biển nào báo hiệu hạn chế tốc độ của phương tiện không vượt quá trị số ghi trên biển?,85,Biển 1.,7,Biển 2.,7,,0,,0,2,2,Biển 2.,False,tốc độ,True,False
178,Bạn có được phép vượt xe mô tô phía trước không?,48,Cho phép.,9,Không được vượt.,16,,0,,0,2,2,Không được vượt.,False,xe mô tô,False,False
179,Nơi nào cấm quay đầu xe?,24,"Ở phần đường dành cho người đi bộ qua đường, trên cầu, đầu cầu, gầm cầu vượt, ngầm.",83,"Tại nơi đường bộ giao nhau cùng mức với đường sắt, đường hẹp, đường dốc, đoạn đường cong tầm nhìn bị che khuất, trên đường cao tốc, trong hầm đường bộ, trên đường một chiều.",173,Cả hai ý trên.,14,,0,3,3,Cả hai ý trên.,False,cấm,False,True
180,Số 50 ghi trên biển báo dưới đây có ý nghĩa như thế nào?,56,Tốc độ tối đa các xe cơ giới được phép chạy.,44,Tốc độ tối thiểu các xe cơ giới được phép chạy.,47,,0,,0,2,1,Tốc độ tối đa các xe cơ giới được phép chạy.,False,biển,False,False
181,Khi hiệu lệnh của người điều khiển giao thông trái với tín hiệu đèn giao thông hoặc biển báo hiệu đường bộ thì người tham gia giao thông đường bộ phải chấp hành báo hiệu đường bộ nào dưới đây?,192,Theo hiệu lệnh của người điều khiển giao thông.,47,Theo tín hiệu đèn giao thông.,29,Theo biển báo hiệu đường bộ.,28,,0,3,1,Theo hiệu lệnh của người điều khiển giao thông.,False,biển,False,True
182,"Trách nhiệm của tổ chức, cá nhân đứng tên trong giấy chứng nhận đăng ký xe khi chưa thực hiện thu hồi chứng nhận đăng ký xe, biển số xe được quy định như thế nào?",162,Tiếp tục chịu trách nhiệm của chủ xe.,37,"Không chịu trách nhiệm sau khi đã chuyển nhượng, trao đổi, tặng, cho.",69,,0,,0,2,1,Tiếp tục chịu trách nhiệm của chủ xe.,False,biển,False,False
183,Biển nào xe được phép rẽ trái?,30,Biển 1.,7,Biển 2.,7,Không biển nào.,17,,0,3,2,Biển 2.,False,biển,True,False
184,"Trước khi cho xe chuyển hướng, người lái xe phải làm gì để bảo đảm an toàn giao thông?",86,"Phải quan sát, bảo đảm khoảng cách an toàn với xe phía sau.",59,Giảm tốc độ và có tín hiệu báo hướng rẽ.,40,"Chuyển dần sang làn gần nhất với hướng rẽ. Khi bảo đảm an toàn, không gây trở ngại cho người và phương tiện khác mới được chuyển hướng.",135,Cả ba ý trên.,13,4,4,Cả ba ý trên.,False,giao thông,False,True
185,"Tại nơi đường giao nhau có báo hiệu đi theo vòng xuyến, người lái xe phải nhường đường như thế nào là đúng quy tắc giao thông?",126,Nhường đường cho xe đi đến từ bên phải.,39,Nhường đường cho xe đi đến từ bên trái.,39,Không phải nhường đường.,24,,0,3,2,Nhường đường cho xe đi đến từ bên trái.,False,giao thông,False,False
186,"Trên đường bộ ngoài khu vực đông dân cư, đường hai chiều hoặc đường một chiều có một làn xe cơ giới (trừ đường cao tốc), loại xe nào dưới đây được tham gia giao thông với tốc độ khai thác tối đa cho phép là 60 km/h?",215,"Xe ô tô chở người đến 28 chỗ không kể chỗ của người lái xe (trừ xe buýt); ô tô tải có trọng tải không lớn hơn 3,5 tấn.",118,"Xe ô tô chở người trên 28 chỗ không kể chỗ người lái xe (trừ xe buýt); ô tô tải có trọng tải trên 3,5 tấn (trừ ô tô xi téc).",124,"Xe buýt; ô tô đầu kéo kéo sơ mi rơ moóc (trừ ô tô đầu kéo kéo sơ mi rơ moóc xi téc); xe mô tô; ô tô chuyên dùng (trừ ô tô trộn vữa, ô tô trộn bê tông lưu động).",160,"Ô tô kéo rơ moóc; ô tô kéo xe khác; ô tô trộn vữa, ô tô trộn bê tông lưu động, ô tô xi téc, ô tô đầu kéo kéo sơ mi rơ moóc xi téc, ô tô kéo theo rơ moóc xi téc.",160,4,3,"Xe buýt; ô tô đầu kéo kéo sơ mi rơ moóc (trừ ô tô đầu kéo kéo sơ mi rơ moóc xi téc); xe mô tô; ô tô chuyên dùng (trừ ô tô trộn vữa, ô tô trộn bê tông lưu động).",False,tốc độ,False,False
187,Gương chiếu hậu của xe mô tô hai bánh có tác dụng gì dưới đây?,62,Để quan sát an toàn phía bên trái khi chuẩn bị rẽ trái.,55,Để quan sát an toàn phía bên phải khi chuẩn bị rẽ phải.,55,Để quan sát an toàn phía sau của bên trái và bên phải trước khi chuyển hướng.,77,Để quan sát an toàn phía trước cả bên trái và bên phải trước khi chuyển hướng.,78,4,3,Để quan sát an toàn phía sau của bên trái và bên phải trước khi chuyển hướng.,False,xe mô tô,False,False
188,Gặp biển nào người tham gia giao thông phải đi chậm và thận trọng đề phòng khả năng xuất hiện và di chuyển bất ngờ của trẻ em trên mặt đường?,141,Biển 1.,7,Biển 2.,7,,0,,0,2,2,Biển 2.,False,biển,True,False
189,Hai biển này có ý nghĩa như thế nào?,36,Để chỉ nơi đường sắt giao vuông góc với đường bộ không có rào chắn.,67,"Để báo trước sắp đến vị trí giao cắt đường bộ với đường sắt cùng mức, không vuông góc và không có người gác, không có rào chắn.",127,Nơi đường sắt giao nhau với đường bộ.,37,,0,3,1,Để chỉ nơi đường sắt giao vuông góc với đường bộ không có rào chắn.,False,biển,False,True
190,Các xe đi theo thứ tự nào là đúng quy tắc giao thông đường bộ?,62,"Xe của bạn, xe mô tô, xe con.",29,"Xe con, xe của bạn, xe mô tô.",29,"Xe mô tô, xe con, xe của bạn.",29,,0,3,2,"Xe con, xe của bạn, xe mô tô.",False,giao thông,False,False
191,Người lái xe sử dụng đèn như thế nào khi đi trên các đoạn đường qua khu đông dân cư có hệ thống chiếu sáng đang hoạt động?,122,Chỉ bật đèn chiếu xa (đèn pha).,31,"Bật đèn chiếu xa (đèn pha) khi đường vắng, bật đèn chiếu gần (đèn cốt) khi có xe đi ngược chiều.",96,Chỉ bật đèn chiếu gần (đèn cốt).,32,,0,3,3,Chỉ bật đèn chiếu gần (đèn cốt).,False,đèn,False,True
192,Biển này có ý nghĩa như thế nào?,32,Cấm dừng xe về hướng bên trái.,30,Cấm dừng và đỗ xe theo hướng bên phải.,38,Được phép đỗ xe và dừng xe theo hướng bên phải.,47,,0,3,2,Cấm dừng và đỗ xe theo hướng bên phải.,False,biển,False,False
193,"Gặp biển báo dưới đây, người lái xe có bắt buộc phải chạy vòng theo đảo an toàn theo hướng mũi tên khi muốn chuyển hướng hay không?",131,Bắt buộc.,9,Không bắt buộc.,15,,0,,0,2,1,Bắt buộc.,False,biển,False,False
194,Các biện pháp tiết kiệm nhiên liệu khi chạy xe?,47,Bảo dưỡng xe theo định kỳ và có kế hoạch lộ trình trước khi xe chạy.,68,Kiểm tra áp suất lốp theo quy định và chạy xe với tốc độ phù hợp với tình trạng mặt đường và mật độ giao thông trên đường.,122,Cả hai ý trên.,14,,0,3,3,Cả hai ý trên.,False,biện,False,True
195,Thứ tự xuống phà như thế nào là đúng quy tắc giao thông?,56,"Xe thô sơ, người đi bộ xuống trước, xe cơ giới, xe máy chuyên dùng xuống sau.",77,"Xe cơ giới, xe máy chuyên dùng xuống trước, xe thô sơ, người đi bộ xuống sau.",77,"Xe cơ giới, xe thô sơ xuống trước, xe máy chuyên dùng, người đi bộ xuống sau.",77,,0,3,2,"Xe cơ giới, xe máy chuyên dùng xuống trước, xe thô sơ, người đi bộ xuống sau.",False,giao thông,False,False
196,"Khi điều khiển xe qua đường sắt, người lái xe cần phải thực hiện các thao tác nào dưới đây để bảo đảm an toàn?",110,"Khi có chuông báo hoặc thanh chắn đã hạ xuống, người lái xe phải dừng xe tạm thời đúng khoảng cách an toàn, kéo phanh tay nếu đường dốc hoặc phải chờ lâu",153,"Khi không có chuông báo hoặc thanh chắn không hạ xuống, người lái xe cần phải quan sát nếu thấy đủ điều kiện an toàn thì về số thấp, tăng ga nhẹ và không thay đổi số trong quá trình vượt qua đường sắt để tránh động cơ chết máy cho xe cho vượt qua.",247,Cả hai ý trên.,14,,0,3,3,Cả hai ý trên.,False,đường sắt,False,True
197,"Người lái xe không điều khiển xe đi đúng làn đường quy định, phóng nhanh, vượt ẩu, vượt đèn đỏ, đi vào đường cấm được coi là hành vi nào trong các hành vi dưới đây?",164,"Là thiếu văn hóa giao thông, vi phạm pháp luật về trật tự, an toàn giao thông đường bộ.",87,Là thiếu văn hóa giao thông.,28,,0,,0,2,1,"Là thiếu văn hóa giao thông, vi phạm pháp luật về trật tự, an toàn giao thông đường bộ.",False,cấm,False,True
198,Khi gặp hiệu lệnh điều khiển của Cảnh Sát Giao Thông như hình dưới đây thì người tham gia giao thông đường bộ phải đi như thế nào là đúng quy tắc giao thông?,157,Người tham gia giao thông đường bộ ở các hướng phải dừng lại.,61,Người tham gia giao thông đường bộ ở các hướng được đi theo chiều gậy chỉ của Cảnh sát giao thông.,98,Người tham gia giao thông đường bộ ở phía trước và phía sau người điều khiển được đi tất cả các hướng; người tham gia giao thông đường bộ ở phía bên phải và phía bên trái người điều khiển phải dừng lại.,202,Người tham gia giao thông đường bộ ở phía trước và phía sau người điều khiển phải dừng lại; người tham gia giao thông đường bộ ở phía bên phải và phía bên trái người điều khiển được đi tất cả các hướng.,202,4,4,Người tham gia giao thông đường bộ ở phía trước và phía sau người điều khiển phải dừng lại; người tham gia giao thông đường bộ ở phía bên phải và phía bên trái người điều khiển được đi tất cả các hướng.,False,giao thông,False,False
199,"Theo hướng mũi tên, thứ tự các xe đi như thế nào là đúng quy tắc giao thông?",76,"Xe tải, xe con, xe mô tô.",25,"Xe con, xe tải, xe mô tô.",25,"Xe mô tô, xe con, xe tải.",25,"Xe con, xe mô tô, xe tải.",25,4,3,"Xe mô tô, xe con, xe tải.",False,giao thông,False,False
200,"Các xe đi theo hướng mũi tên, xe nào vi phạm quy tắc giao thông?",64,"Xe con, xe tải, xe khách.",25,"Xe tải, xe khách, xe mô tô.",27,"Xe khách, xe mô tô, xe con.",27,Cả bốn xe.,10,4,2,"Xe tải, xe khách, xe mô tô.",False,giao thông,False,True
201,"Trên đường bộ, trong khu vực đông dân cư, đường đôi hoặc đường một chiều có từ hai làn xe cơ giới trở lên, xe mô tô hai bánh, ô tô chở người đến 28 chỗ không kể chỗ của người lái xe tham gia giao thông với tốc độ khai thác tối đa cho phép là bao nhiêu?",252,60 km/h.,8,50 km/h.,8,40 km/h.,8,,0,3,1,60 km/h.,False,xe mô tô,False,False
202,Người có mặt tại nơi xảy ra vụ tai giao thông đường bộ có trách nhiệm gì dưới đây?,82,"Giúp đỡ, cứu chữa kịp thời người bị nạn; báo tin ngay cho cơ quan Công an, cơ sở khám bệnh, chữa bệnh hoặc Ủy ban nhân dân nơi gần nhất; tham gia bảo vệ hiện trường; tham gia bảo vệ tài sản của người bị nạn; cung cấp thông tin liên quan về vụ tai nạn theo yêu cầu của cơ quan có thẩm quyền.",290,Chụp lại hình ảnh vụ tai nạn (nếu có thiết bị ghi hình) và nhanh chóng rời khỏi hiện trường vụ tai nạn.,103,Cả hai ý trên.,14,,0,3,1,"Giúp đỡ, cứu chữa kịp thời người bị nạn; báo tin ngay cho cơ quan Công an, cơ sở khám bệnh, chữa bệnh hoặc Ủy ban nhân dân nơi gần nhất; tham gia bảo vệ hiện trường; tham gia bảo vệ tài sản của người bị nạn; cung cấp thông tin liên quan về vụ tai nạn theo yêu cầu của cơ quan có thẩm quyền.",False,giao thông,False,True
203,Biển báo dưới đây có ý nghĩa như thế nào?,41,Báo hiệu tốc độ tối đa cho phép các xe cơ giới chạy.,52,Báo hiệu tốc độ tối thiểu cho phép các xe cơ giới chạy.,55,,0,,0,2,2,Báo hiệu tốc độ tối thiểu cho phép các xe cơ giới chạy.,False,biển,False,False
204,"Biển nào báo hiệu ""Giao nhau có tín hiệu đèn""?",46,Biển 1.,7,Biển 2.,7,Biển 3.,7,Cả ba biển.,11,4,3,Biển 3.,False,biển,True,False
205,"Khi đèn pha của xe đi ngược chiều gây chói mắt, làm giảm khả năng quan sát trên đường, người lái xe xử lý như thế nào dưới đây để bảo đảm an toàn?",146,"Giảm tốc độ, giữ vững tay lái, nhìn chếch sang lề đường bên phải.",65,Bật đèn pha chiếu xa và giữ nguyên tốc độ.,42,"Tăng tốc độ, bật đèn pha đối diện xe phía trước.",48,,0,3,1,"Giảm tốc độ, giữ vững tay lái, nhìn chếch sang lề đường bên phải.",False,an toàn,False,False
206,"Trong các trường hợp dưới đây, để bảo đảm an toàn khi tham gia giao thông, người lái xe mô tô cần thực hiện như thế nào?",120,"Phải đội mũ bảo hiểm theo đúng quy chuẩn kỹ thuật quốc gia và cài quai đúng quy cách, không sử dụng ô, điện thoại di động, thiết bị âm thanh (trừ thiết bị trợ thính).",166,"Phải đội mũ bảo hiểm khi trời mưa gió hoặc trời quá nắng; có thể sử dụng ô, điện thoại di động, thiết bị âm thanh nhưng phải bảo đảm an toàn.",141,Phải đội mũ bảo hiểm khi cảm thấy mất an toàn giao thông hoặc khi chuẩn bị di chuyển quãng đường xa.,100,,0,3,1,"Phải đội mũ bảo hiểm theo đúng quy chuẩn kỹ thuật quốc gia và cài quai đúng quy cách, không sử dụng ô, điện thoại di động, thiết bị âm thanh (trừ thiết bị trợ thính).",False,xe mô tô,False,False
207,"Biển nào báo hiệu ""Giao nhau với đường hai chiều""?",50,Biển 1.,7,Biển 2.,7,Biển 3.,8,,0,3,1,Biển 1.,False,biển,True,False
208,Hành vi đua xe trái phép bị xử lý như thế nào?,46,Chỉ bị nhắc nhở.,16,Tùy theo mức độ của hành vi vi phạm có thể bị xử lý hành chính hoặc xử lý hình sự.,82,,0,,0,2,2,Tùy theo mức độ của hành vi vi phạm có thể bị xử lý hành chính hoặc xử lý hình sự.,False,hành,False,False
209,Biển nào xe quay đầu không bị cấm?,34,Biển 1.,7,Biển 2.,7,Cả hai biển.,12,,0,3,3,Cả hai biển.,False,biển,True,False
210,Hành vi nào sau đây bị cấm?,27,"Lắp đặt, sử dụng thiết bị âm thanh, ánh sáng trên xe cơ giới, xe máy chuyên dùng gây mất trật tự, an toàn giao thông đường bộ.",126,"Cản trở người, phương tiện tham gia giao thông trên đường bộ; ném gạch, đất, đá, cát hoặc vật thể khác vào người, phương tiện đang tham gia giao thông trên đường bộ.",165,Cả hai ý trên.,14,,0,3,3,Cả hai ý trên.,False,cấm,False,True
211,"Biển nào sau đây là biển ""Dốc xuống nguy hiểm""?",47,Biển 1.,7,Biển 2.,7,,0,,0,2,1,Biển 1.,False,biển,True,False
212,"Theo hướng mũi tên, xe nào chấp hành đúng quy tắc giao thông?",61,"Xe khách, xe tải, xe mô tô.",27,"Xe tải, xe mô tô.",17,Chỉ xe con.,11,Cả bốn xe.,10,4,3,Chỉ xe con.,False,giao thông,False,True
213,"Theo hướng mũi tên, thứ tự các xe đi như thế nào là đúng quy tắc giao thông?",76,"Xe khách, xe tải, xe mô tô, xe con.",35,"Xe con, xe khách, xe tải, xe mô tô.",35,"Xe mô tô, xe tải, xe khách, xe con.",35,"Xe mô tô, xe tải, xe con, xe khách.",35,4,3,"Xe mô tô, xe tải, xe khách, xe con.",False,giao thông,False,False
214,Xe nào được quyền đi trước trong trường hợp này?,48,Xe mô tô.,9,Xe con.,7,,0,,0,2,1,Xe mô tô.,False,quyền,False,False
215,"Khi tầm nhìn bị hạn chế bởi sương mù hoặc mưa to, người lái xe phải thực hiện các thao tác nào để bảo đảm an toàn?",114,"Tăng tốc độ, chạy gần xe trước, nhìn đèn hậu để định hướng.",59,"Giảm tốc độ, chạy cách xa xe trước với khoảng cách an toàn, bật đèn sương mù và đèn chiếu gần.",94,"Tăng tốc độ, bật đèn pha vượt qua xe chạy trước.",48,,0,3,2,"Giảm tốc độ, chạy cách xa xe trước với khoảng cách an toàn, bật đèn sương mù và đèn chiếu gần.",False,an toàn,False,True
216,"Biển nào báo hiệu ""Giao nhau với đường không ưu tiên""?",54,Biển 1.,7,Biển 2.,7,Biển 3.,7,Biển 2 và biển 3.,20,4,1,Biển 1.,False,biển,True,False
217,"Trong trường hợp này, thứ tự xe đi như thế nào là đúng quy tắc giao thông?",74,"Xe công an đi làm nhiệm vụ khẩn cấp, xe quân sự đi làm nhiệm vụ khẩn cấp, xe con + xe mô tô.",92,"Xe quân sự đi làm nhiệm vụ khẩn cấp, xe công an đi làm nhiệm vụ khẩn cấp, xe con + xe mô tô.",92,"Xe mô tô + xe con, xe quân sự đi làm nhiệm vụ khẩn cấp, xe công an đi làm nhiệm vụ khẩn cấp.",92,,0,3,2,"Xe quân sự đi làm nhiệm vụ khẩn cấp, xe công an đi làm nhiệm vụ khẩn cấp, xe con + xe mô tô.",False,giao thông,False,False
218,"Khi chuyển làn đường, người lái xe phải bật đèn tín hiệu báo rẽ như thế nào là đúng quy tắc giao thông?",103,Khi bắt đầu chuyển làn đường.,29,Trước khi thay đổi làn đường.,29,Sau khi thay đổi làn đường.,27,,0,3,2,Trước khi thay đổi làn đường.,False,giao thông,False,False
219,Biển nào chỉ dẫn cho người đi bộ sử dụng hầm chui qua đường?,60,Biển 1.,7,Biển 2.,7,Cả hai biển.,14,Không biển nào.,17,4,2,Biển 2.,False,biển,True,False
220,"Khi tránh xe đi ngược chiều, các xe phải nhường đường như thế nào là đúng quy tắc giao thông?",93,"Nơi đường hẹp chỉ đủ cho một xe chạy và có chỗ tránh xe thì xe nào ở gần chỗ tránh hơn phải vào vị trí tránh, nhường đường cho xe đi ngược chiều.",145,Xe xuống dốc phải nhường đường cho xe lên dốc.,46,Xe có chướng ngại vật phía trước phải nhường đường cho xe không có chướng ngại vật phía trước.,94,Cả ba ý trên.,13,4,4,Cả ba ý trên.,False,giao thông,False,True
221,Biển báo này có ý nghĩa như thế nào?,36,Tốc độ tối đa cho phép về ban đêm cho các phương tiện là 70 km/h.,65,Tốc độ tối thiểu cho phép về ban đêm cho các phương tiện là 70 km/h.,68,,0,,0,2,1,Tốc độ tối đa cho phép về ban đêm cho các phương tiện là 70 km/h.,False,biển,False,False
222,"Những trường hợp nào dưới đây không được đi trên đường cao tốc, trừ người, phương tiện giao thông đường bộ và thiết bị phục vụ việc quản lý, bảo trì đường cao tốc?",163,"Xe máy chuyên dùng có tốc độ thiết kế nhỏ hơn tốc độ tối thiểu quy định đối với đường cao tốc, xe chở người bốn bánh có gắn động cơ, xe chở hàng bốn bánh có gắn động cơ, xe mô tô, xe gắn máy, các loại xe tương tự xe mô tô, xe gắn máy, xe thô sơ, người đi bộ.",258,Xe máy chuyên dùng có tốc độ thiết kế lớn hơn tốc độ tối thiểu quy định đối với đường cao tốc.,94,Xe ô tô và xe máy chuyên dùng có tốc độ thiết kế lớn hơn 80 km/h.,65,,0,3,1,"Xe máy chuyên dùng có tốc độ thiết kế nhỏ hơn tốc độ tối thiểu quy định đối với đường cao tốc, xe chở người bốn bánh có gắn động cơ, xe chở hàng bốn bánh có gắn động cơ, xe mô tô, xe gắn máy, các loại xe tương tự xe mô tô, xe gắn máy, xe thô sơ, người đi bộ.",False,giao thông,False,True
223,"Khi điều khiển xe mô tô quay đầu, người lái xe cần thực hiện như thế nào để bảo đảm an toàn?",92,"Bật tín hiệu báo rẽ trước khi quay đầu, từ từ giảm tốc độ đến mức có thể dừng lại.",82,Chỉ quay đầu xe tại những nơi được phép quay đầu.,49,"Quan sát an toàn các phương tiện tới từ phía trước, phía sau, hai bên đồng thời nhường đường cho xe từ bên phải và phía trước đi tới.",133,Cả ba ý trên.,13,4,4,Cả ba ý trên.,False,xe mô tô,False,True
224,Vạch kẻ đường là gì?,20,Là báo hiệu đường bộ để hỗ trợ cảnh báo nguy hiểm cho người tham gia giao thông đường bộ.,89,"Là vạch chỉ sự phân chia làn đường, vị trí hoặc hướng đi, vị trí dừng lại.",74,Là báo hiệu cho người tham gia giao thông đường bộ về các thông tin của đường bộ.,81,Cả ba ý trên.,13,4,2,"Là vạch chỉ sự phân chia làn đường, vị trí hoặc hướng đi, vị trí dừng lại.",False,vạch,False,True
225,"Khi lái xe trong khu đông dân cư, khu vực cơ sở khám bệnh, chữa bệnh trừ các khu vực có biển cấm sử dụng còi, người lái xe được sử dụng còi trong thời gian nào?",160,Từ 22 giờ ngày hôm trước đến 05 giờ ngày hôm sau.,49,Từ 05 giờ đến 22 giờ.,21,Từ 23 giờ ngày hôm trước đến 05 giờ sáng hôm sau.,49,,0,3,2,Từ 05 giờ đến 22 giờ.,False,biển,False,False
226,Biển nào xe được phép rẽ trái?,30,Biển 1.,7,Biển 2.,7,Không biển nào.,17,,0,3,2,Biển 2.,False,biển,True,False
227,Người lái xe được hiểu như thế nào là đúng?,43,Là người điều khiển xe cơ giới.,31,Là người điều khiển xe thô sơ.,30,Là người điều khiển xe máy chuyên dùng.,39,,0,3,1,Là người điều khiển xe cơ giới.,False,hiểu,False,False
228,"Biển nào báo hiệu ""Chú ý chướng ngại vật""?",42,Biển 1.,7,Biển 2 và biển 3.,19,Biển 3.,7,,0,3,2,Biển 2 và biển 3.,False,biển,True,True
229,"Hành vi đưa xe cơ giới, xe máy chuyên dùng tham gia giao thông đường bộ nào dưới đây bị cấm?",92,Không có chứng nhận kiểm định an toàn kỹ thuật và bảo vệ môi trường.,68,Hết niên hạn sử dụng.,21,Cả hai ý trên.,14,,0,3,3,Cả hai ý trên.,False,giao thông,False,True
230,Biển nào không cho phép rẽ phải?,32,Biển 1.,7,Biển 2.,7,Biển 3.,7,Biển 1 và biển 3.,20,4,1,Biển 1.,False,biển,True,False
