question_number,question_text,question_length,option1,option1_length,option2,option2_length,option3,option3_length,option4,option4_length,option_count,correct_answer_numbers,correct_answer_text,required,keyword,image,short_last_option
57,"Trong các loại nhiên liệu dưới đây, loại nhiên liệu nào giảm thiểu ô nhiễm môi trường?",86,Xăng và dầu diesel.,19,Xăng sinh học và khí sinh học.,30,Ý 1 và ý 2.,11,,0,3,2,Xăng sinh học và khí sinh học.,False,loại,False,True
58,Biển nào cấm các phương tiện rẽ phải?,37,Biển 1 và 2.,12,Biển 1 và 3.,12,Biển 2 và 3.,12,Cả ba biển.,11,4,1,Biển 1 và 2.,False,biển,True,False
59,"Trong nhóm các phương tiện giao thông đường bộ dưới đây, nhóm phương tiện nào là xe cơ giới?",92,"Xe ô tô; máy kéo; xe mô tô hai bánh; xe mô tô ba bánh; xe gắn máy; xe cơ giới dùng cho người khuyết tật và xe máy chuyên dùng; xe đạp, xe đạp máy, xe đạp điện.",159,"Xe ô tô; rơ moóc được kéo bởi xe ô tô; sơ mi rơ moóc được kéo bởi ô tô đầu kéo; xe chở người bốn bánh có gắn động cơ; xe chở hàng bốn bánh có gắn động cơ; xe mô tô, xe gắn máy và các loại xe tương tự.",200,,0,,0,2,2,"Xe ô tô; rơ moóc được kéo bởi xe ô tô; sơ mi rơ moóc được kéo bởi ô tô đầu kéo; xe chở người bốn bánh có gắn động cơ; xe chở hàng bốn bánh có gắn động cơ; xe mô tô, xe gắn máy và các loại xe tương tự.",False,giao thông,False,False
60,Xe nào được quyền đi trước trong trường hợp này?,48,Xe con.,7,Xe mô tô.,9,,0,,0,2,2,Xe mô tô.,False,quyền,False,False
61,"Trên đường không phân chia thành hai chiều xe chạy riêng biệt, người điều khiển phương tiện tham gia giao thông đường bộ phải tránh xe đi ngược chiều như thế nào để bảo đảm an toàn?",181,Giảm tốc độ và cho xe đi về bên phải theo chiều xe chạy của mình.,65,Một trong hai xe phải dừng lại cho xe kia đi qua mới được đi.,61,"Tăng tốc độ, cho xe đi về bên phải theo chiều xe chạy của mình để nhanh chóng vượt qua.",87,,0,3,1,Giảm tốc độ và cho xe đi về bên phải theo chiều xe chạy của mình.,False,giao thông,False,False
62,"Gặp biển báo này, người tham gia giao thông phải xử lý như thế nào?",67,Dừng xe tại khu vực có trạm Cảnh sát giao thông.,48,Tiếp tục lưu thông với tốc độ bình thường.,42,Phải giảm tốc độ đến mức an toàn và không được vượt khi đi qua khu vực này.,75,,0,3,3,Phải giảm tốc độ đến mức an toàn và không được vượt khi đi qua khu vực này.,False,biển,False,False
63,Người điều khiển phương tiện tham gia giao thông đường bộ mà trong máu hoặc hơi thở có nồng độ cồn có bị nghiêm cấm không?,122,Bị nghiêm cấm.,14,Không bị nghiêm cấm.,20,"Không bị nghiêm cấm, nếu nồng độ cồn trong máu ở mức nhẹ, có thể điều khiển phương tiện tham gia giao thông.",108,,0,3,1,Bị nghiêm cấm.,False,giao thông,False,False
64,Người lái xe mô tô có văn hóa giao thông khi tham gia giao thông phải tuân thủ những quy định nào dưới đây?,107,"Điều khiển xe đi bên phải theo chiều đi của mình; đi đúng phần đường, làn đường quy định; đội mũ bảo hiểm đúng quy chuẩn kỹ thuật quốc gia, cài quai đúng quy cách.",163,"Điều khiển xe đi trên phần đường, làn đường có ít phương tiện tham gia giao thông.",82,Điều khiển xe và đội mũ bảo hiểm ở nơi có biển báo bắt buộc đội mũ bảo hiểm.,76,,0,3,1,"Điều khiển xe đi bên phải theo chiều đi của mình; đi đúng phần đường, làn đường quy định; đội mũ bảo hiểm đúng quy chuẩn kỹ thuật quốc gia, cài quai đúng quy cách.",False,xe mô tô,False,True
65,Người điều khiển phương tiện tham gia giao thông đường bộ được hiểu như thế nào là đúng?,88,"Là người điều khiển xe cơ giới, người điều khiển xe thô sơ, người điều khiển xe máy chuyên dùng.",96,Là người được giao nhiệm vụ hướng dẫn giao thông trên đường bộ.,63,Cả hai ý trên.,14,,0,3,1,"Là người điều khiển xe cơ giới, người điều khiển xe thô sơ, người điều khiển xe máy chuyên dùng.",False,giao thông,False,True
66,“Làn đường” là gì?,18,"Là một phần của phần đường xe chạy được chia theo chiều dọc của đường, sử dụng cho xe chạy.",91,"Là một phần của phần đường xe chạy được chia theo chiều dọc của đường, có đủ chiều rộng cho xe chạy an toàn.",108,"Là đường cho xe ô tô chạy, dừng, đỗ an toàn.",44,,0,3,2,"Là một phần của phần đường xe chạy được chia theo chiều dọc của đường, có đủ chiều rộng cho xe chạy an toàn.",False,làn,False,True
67,"Người lái xe mô tô hai bánh, xe mô tô ba bánh, xe gắn máy không được thực hiện các hành vi nào dưới đây?",104,Đi xe dàn hàng ngang; đi xe vào phần đường dành cho người đi bộ và phương tiện khác.,84,"Sử dụng ô, thiết bị âm thanh, trừ thiết bị trợ thính.",53,Cả hai ý trên.,14,,0,3,3,Cả hai ý trên.,False,xe mô tô,False,True
68,"Người lái xe được phép vượt xe trên cầu hẹp có một làn đường, đường cong có tầm nhìn bị hạn chế hay không?",106,Được phép vượt khi đường vắng.,30,Không được phép vượt.,21,Được phép vượt khi có việc gấp.,31,,0,3,2,Không được phép vượt.,False,vượt,False,False
69,Biển nào báo hiệu sắp đến chỗ giao nhau giữa đường bộ và đường sắt?,67,Biển 1.,7,Biển 2.,7,Biển 3.,7,Cả 1 và biển 3.,17,4,1,Biển 1.,False,biển,True,False
70,Có bao nhiêu nhóm biển báo hiệu đường bộ?,41,"Ba nhóm: Biển báo cấm, biển báo nguy hiểm và biển hiệu lệnh.",60,"Bốn nhóm: Biển báo cấm, biển báo nguy hiểm, biển hiệu lệnh và biển phụ.",71,"Năm nhóm: Biển báo cấm, biển báo nguy hiểm, biển hiệu lệnh, biển chỉ dẫn, biển phụ.",83,,0,3,3,"Năm nhóm: Biển báo cấm, biển báo nguy hiểm, biển hiệu lệnh, biển chỉ dẫn, biển phụ.",False,biển,False,False
71,"Người điều khiển xe mô tô hai bánh, xe mô tô ba bánh, xe gắn máy có được phép sử dụng xe để kéo hoặc đẩy các phương tiện khác khi tham gia giao thông không?",156,Được phép.,10,"Nếu phương tiện được kéo, đẩy có khối lượng nhỏ hơn phương tiện của mình.",73,Tùy trường hợp.,15,Không được phép.,16,4,4,Không được phép.,False,xe mô tô,False,True
72,"Trường hợp người được chở trên xe mô tô, xe gắn máy, các loại xe tương tự xe mô tô và các loại xe tương tự xe gắn máy không đội ""mũ bảo hiểm cho người đi mô tô, xe máy"" hoặc không cài quai đúng quy cách (trừ trường hợp chở người bệnh đi cấp cứu, trẻ em dưới 06 tuổi, áp giải người có hành vi vi phạm pháp luật) thì việc xử phạt vi phạm hành chính được quy định như thế nào?",373,Không bị xử phạt chỉ bị nhắc nhở.,33,"Người được chở không bị xử phạt, chỉ xử phạt người điều khiển xe mô tô, xe gắn máy.",83,"Người được chở bị xử phạt, không xử phạt người điều khiển xe mô tô, xe gắn máy.",79,"Xử phạt cả người điều khiển và người được chở trên xe mô tô, xe gắn máy.",72,4,4,"Xử phạt cả người điều khiển và người được chở trên xe mô tô, xe gắn máy.",False,xe mô tô,False,False
73,"Người có giấy phép lái xe chưa bị trừ hết 12 điểm, được phục hồi điểm giấy phép lái xe trong trường hợp nào sau đây?",116,Không được phục hồi.,20,"Được phục hồi đủ 12 điểm, nếu không bị trừ điểm trong thời hạn 12 tháng từ ngày bị trừ điểm gần nhất.",101,,0,,0,2,2,"Được phục hồi đủ 12 điểm, nếu không bị trừ điểm trong thời hạn 12 tháng từ ngày bị trừ điểm gần nhất.",False,giấy phép,False,False
74,Gặp biển nào người lái xe phải nhường đường cho người đi bộ?,60,Biển 1.,7,Biển 2.,7,Biển 3.,7,,0,3,1,Biển 1.,False,biển,True,False
75,"Khi điều khiển phương tiện tham gia giao thông, hành vi nào sau đây bị cấm?",75,Dùng tay cầm và sử dụng điện thoại hoặc thiết bị điện tử khác.,62,"Chỉ được chở người trên thùng xe ô tô chở hàng trong trường hợp chở người đi làm nhiệm vụ cứu nạn, cứu hộ, phòng, chống thiên tai, dịch bệnh hoặc thực hiện nhiệm vụ khẩn cấp.",174,,0,,0,2,1,Dùng tay cầm và sử dụng điện thoại hoặc thiết bị điện tử khác.,False,giao thông,False,False
76,"Các xe đi theo hướng mũi tên, xe nào chấp hành đúng quy tắc giao thông?",71,"Xe tải, xe mô tô.",17,"Xe khách, xe mô tô.",19,"Xe tải, xe con.",15,"Xe mô tô, xe con.",17,4,2,"Xe khách, xe mô tô.",False,giao thông,False,False
77,Biển báo dưới đây có ý nghĩa như thế nào?,41,Chỉ dẫn khoảng cách đến làn đường cứu nạn (làn thoát xe khẩn cấp).,66,Báo hiệu đường cụt phía trước.,30,Báo hiệu nút giao gần nhất phía trước.,38,Báo hiệu trạm dừng nghỉ phía trước.,35,4,1,Chỉ dẫn khoảng cách đến làn đường cứu nạn (làn thoát xe khẩn cấp).,False,biển,False,True
78,"Khi có tín hiệu của xe ưu tiên, người và phương tiện tham gia giao thông đường bộ phải tuân thủ quy định nào dưới đây?",118,"Giảm tốc độ, đi sát lề đường bên phải hoặc dừng lại để nhường đường.",68,Tăng tốc độ và đi sát lề đường bên phải để nhường đường.,56,"Giảm tốc độ, đi sát lề đường bên trái để nhường đường.",54,,0,3,1,"Giảm tốc độ, đi sát lề đường bên phải hoặc dừng lại để nhường đường.",False,giao thông,False,False
79,Vạch mũi tên chỉ hướng trên mặt đường nào dưới đây cho phép xe chỉ được đi thẳng và rẽ phải?,92,Vạch 1.,7,Vạch 2 và vạch 3.,17,Vạch 3.,7,Vạch 1 và vạch 2.,17,4,3,Vạch 3.,False,vạch,False,False
80,Người lái xe không được vượt xe khác khi gặp trường hợp nào dưới đây?,69,"Trên cầu hẹp có một làn đường; nơi đường giao nhau, đường bộ giao nhau cùng mức với đường sắt; khi gặp xe ưu tiên.",114,Trên cầu có từ 02 làn xe trở lên.,33,Trên đường có 02 làn đường được phân chia làn bằng vạch kẻ nét đứt.,67,,0,3,1,"Trên cầu hẹp có một làn đường; nơi đường giao nhau, đường bộ giao nhau cùng mức với đường sắt; khi gặp xe ưu tiên.",False,không,False,True
81,Người lái xe trên đường cần chấp hành quy định về tốc độ tối đa như thế nào?,76,Chỉ lớn hơn tốc độ tối đa cho phép khi đường vắng.,50,Chỉ lớn hơn tốc độ tối đa cho phép khi vào ban đêm.,51,Không vượt quá tốc độ tối đa cho phép.,38,,0,3,3,Không vượt quá tốc độ tối đa cho phép.,False,tốc độ,False,False
82,Biển nào cấm xe rẽ trái?,24,Biển 1.,7,Biển 2.,7,Cả hai biển.,12,,0,3,1,Biển 1.,False,biển,True,False
83,"Tại nơi có vạch kẻ đường hoặc tại nơi mà người đi bộ, xe lăn của người khuyết tật đang qua đường, người điều khiển phương tiện tham gia giao thông phải thực hiện như thế nào?",174,"Giảm tốc độ và nhường đường cho người đi bộ, xe lăn của người khuyết tật qua đường đảm bảo an toàn.",99,"Quan sát, giảm tốc độ hoặc dừng lại để bảo đảm an toàn cho người đi bộ, xe lăn của người khuyết tật qua đường.",110,"Quan sát, tăng tốc độ và điều khiển phương tiện nhanh chóng đi qua.",67,,0,3,2,"Quan sát, giảm tốc độ hoặc dừng lại để bảo đảm an toàn cho người đi bộ, xe lăn của người khuyết tật qua đường.",False,giao thông,False,False
84,Khái niệm về văn hóa giao thông được hiểu như thế nào là đúng?,62,"Là sự hiểu biết và chấp hành nghiêm chỉnh pháp luật về giao thông, là ý thức trách nhiệm với cộng đồng khi tham gia giao thông.",127,"Là sự tôn trọng, nhường nhịn, giúp đỡ và ứng xử có văn hóa giữa những người tham gia giao thông với nhau.",105,Cả hai ý trên.,14,,0,3,3,Cả hai ý trên.,False,giao thông,False,True
85,"Người được chở trên xe mô tô hai bánh, xe mô tô ba bánh, xe gắn máy khi tham gia giao thông đường bộ có được bám, kéo hoặc đẩy các phương tiện khác không?",154,Được phép.,10,Được bám trong trường hợp phương tiện của mình bị hỏng.,55,"Được kéo, đẩy trong trường hợp phương tiện khác bị hỏng.",56,Không được phép.,16,4,4,Không được phép.,False,xe mô tô,False,True
86,Người lái xe khi tham gia giao thông đường bộ phải đảm bảo các điều kiện nào dưới đây?,86,"Phải đủ tuổi, sức khỏe theo quy định của pháp luật; có giấy phép lái xe đang còn điểm, còn hiệu lực phù hợp với loại xe đang điều khiển do cơ quan có thẩm quyền cấp (trừ người lái xe gắn máy).",192,Phải là người đứng tên trong đăng ký xe.,40,Cả hai ý trên.,14,,0,3,1,"Phải đủ tuổi, sức khỏe theo quy định của pháp luật; có giấy phép lái xe đang còn điểm, còn hiệu lực phù hợp với loại xe đang điều khiển do cơ quan có thẩm quyền cấp (trừ người lái xe gắn máy).",False,giao thông,False,True
87,"Theo hướng mũi tên, những hướng nào xe gắn máy được phép đi?",60,Cả ba hướng.,12,Chỉ hướng 1 và 3.,17,Chỉ hướng 1.,12,,0,3,1,Cả ba hướng.,False,theo,False,False
88,"Biển nào báo hiệu ""Hết đoạn đường ưu tiên""?",43,Biển 1.,7,Biển 2.,7,Biển 3.,7,,0,3,3,Biển 3.,False,biển,True,False
89,"Theo tín hiệu đèn, xe nào đi là đúng quy tắc giao thông?",56,Xe con và xe khách.,19,Xe mô tô.,9,,0,,0,2,1,Xe con và xe khách.,False,giao thông,False,True
90,"Khi ở một vị trí vừa có biển báo hiệu đặt cố định vừa có biển báo hiệu tạm thời mà hai biển có ý nghĩa khác nhau, người tham gia giao thông đường bộ phải chấp hành hiệu lệnh của biển báo hiệu nào?",196,Biển báo hiệu đặt cố định.,26,Biển báo hiệu tạm thời.,23,Theo quyết định của người tham gia giao thông nhưng phải bảo đảm an toàn.,73,,0,3,2,Biển báo hiệu tạm thời.,False,biển,False,False
91,Hành vi nào dưới đây bị nghiêm cấm?,35,Sử dụng xe đạp đi trên các tuyến quốc lộ.,41,"Rải vật sắc nhọn, đổ chất gây trơn trượt trên đường bộ.",55,Cả hai ý trên.,14,,0,3,2,"Rải vật sắc nhọn, đổ chất gây trơn trượt trên đường bộ.",False,cấm,False,True
92,Phương tiện tham gia giao thông đường bộ di chuyển với tốc độ thấp hơn phải đi như thế nào?,91,Đi về bên trái theo chiều đi của mình.,38,Đi về bên phải theo chiều đi của mình.,38,Đi ở bất cứ bên nào nhưng phải bấm đèn cảnh báo nguy hiểm để báo hiệu cho các phương tiện khác.,95,,0,3,2,Đi về bên phải theo chiều đi của mình.,False,tốc độ,False,False
93,"Người lái xe mô tô hai bánh, xe mô tô ba bánh, xe gắn máy không được thực hiện các hành vi nào dưới đây?",104,Đi xe dàn hàng ngang; buông cả hai tay.,39,"Sử dụng xe để kéo, đẩy xe khác, vật khác, dẫn dắt vật nuôi, mang, vác và chở vật cồng kềnh; chở người đứng trên xe, giá đèo hàng hoặc ngồi trên tay lái; xếp hàng hóa trên xe quá giới hạn quy định.",196,"Ngồi về một bên điều khiển xe; đứng, nằm trên xe điều khiển xe; thay người lái xe khi xe đang chạy; quay người về phía sau để điều khiển xe hoặc bịt mắt điều khiển xe; sử dụng chân chống hoặc vật khác quệt xuống đường khi xe đang chạy.",235,Cả ba ý trên.,13,4,4,Cả ba ý trên.,False,xe mô tô,False,True
94,"Khi tới đường ngang không có người gác, chắn đường bộ, chuông, đèn tín hiệu, người tham gia giao thông đường bộ phải làm gì để bảo đảm an toàn?",143,"Dừng lại về bên phải đường của mình, trước vạch dừng xe và quan sát hai phía, khi không có phương tiện giao thông đường sắt tới mới được đi qua.",144,"Quan sát hai phía, khi không có phương tiện giao thông đường sắt tới thì nhanh chóng đi qua.",92,"Dừng lại khoảng cách tối thiểu 3 mét tính từ ray đường sắt gần nhất, khi không có phương tiện giao thông đường sắt tới thì nhanh chóng đi qua.",142,,0,3,1,"Dừng lại về bên phải đường của mình, trước vạch dừng xe và quan sát hai phía, khi không có phương tiện giao thông đường sắt tới mới được đi qua.",False,giao thông,False,False
95,Biển nào báo hiệu các phương tiện phải tuân thủ tốc độ tối đa cho phép trên từng làn đường?,91,Biển 1.,7,Biển 2.,7,Cả hai biển.,14,,0,3,3,Cả hai biển.,False,tốc độ,True,False
96,"Biển nào báo hiệu ""Giao nhau với đường ưu tiên""?",48,Biển 1.,7,Biển 2.,7,Biển 3.,7,Cả ba biển.,13,4,3,Biển 3.,False,biển,True,False
97,Biển nào cấm quay đầu xe?,25,Biển 1.,7,Biển 2.,7,Không biển nào.,17,Cả hai biển..,13,4,2,Biển 2.,False,biển,True,False
98,"Biển nào báo hiệu ""Cầu vượt liên thông""?",40,Biển 2 và biển 3.,17,Biển 1 và biển 2.,17,Biển 1 và biển 3.,17,Cả ba biển.,11,4,3,Biển 1 và biển 3.,False,biển,True,False
99,"Khi có xe xin vượt, người lái xe mô tô xử lý như thế nào nếu đủ điều kiện an toàn cho xe phía sau vượt?",103,"Giảm tốc độ, có tín hiệu rẽ phải để báo hiệu cho người điều khiển phương tiện tham gia giao thông đường bộ phía sau biết được vượt và đi sát về bên phải của phần đường xe chạy cho đến khi xe sau đã vượt qua, không được cản trở đối với xe xin vượt.",247,"Lái xe vào lề đường bên trái và giảm tốc độ để xe phía sau vượt qua, không được gây trở ngại đối với xe xin vượt.",113,"Tăng tốc độ, đi sát về bên phải của phần đường xe chạy cho đến khi xe sau đã vượt qua.",86,,0,3,1,"Giảm tốc độ, có tín hiệu rẽ phải để báo hiệu cho người điều khiển phương tiện tham gia giao thông đường bộ phía sau biết được vượt và đi sát về bên phải của phần đường xe chạy cho đến khi xe sau đã vượt qua, không được cản trở đối với xe xin vượt.",False,xe mô tô,False,True
100,"Biển nào báo hiệu ""Kết thúc đường đôi""?",39,Biển 1.,7,Biển 2.,7,Biển 3.,7,,0,3,3,Biển 3.,False,biển,True,False
101,"Tại đoạn đường có biển ""Làn đường dành riêng cho từng loại xe"" dưới đây, các phương tiện có được phép chuyển sang làn khác để đi theo hành trình mong muốn khi đến gần nơi đường bộ giao nhau hay không?",200,Được phép chuyển sang làn khác.,31,"Không được phép chuyển sang làn khác, chỉ được đi trong làn quy định theo biển.",79,,0,,0,2,1,Được phép chuyển sang làn khác.,False,biển,False,False
102,"Biển nào báo hiệu ""Nơi đỗ xe dành cho người khuyết tật""?",56,Biển 1.,7,Biển 2.,7,Biển 3.,8,,0,3,2,Biển 2.,False,biển,True,False
103,Khi gặp biển nào xe ưu tiên theo luật định vẫn phải dừng lại?,61,Biển 1.,7,Biển 2.,7,Cả ba biển.,11,,0,3,2,Biển 2.,False,biển,True,False
104,Xe nào được quyền đi trước trong trường hợp này?,48,Xe mô tô.,9,Xe con.,7,,0,,0,2,1,Xe mô tô.,False,quyền,False,False
105,"Biển nào báo hiệu ""Đường hai chiều""?",36,Biển 1.,7,Biển 2.,7,Biển 3.,7,,0,3,1,Biển 1.,False,biển,True,False
106,"Biển nào báo hiệu ""Đường hầm""?",30,Cả ba biển.,11,Biển 2.,7,Biển 2 và biển 3.,17,,0,3,2,Biển 2.,False,biển,True,False
107,"Tại nơi đường giao nhau, người lái xe đang đi trên đường không ưu tiên, đường nhánh phải nhường đường như thế nào là đúng quy tắc giao thông?",141,Nhường đường cho xe đi ở bên phải mình tới.,43,Nhường đường cho xe đi ở bên trái mình tới.,43,Nhường đường cho xe đi trên đường ưu tiên hoặc đường chính từ bất kỳ hướng nào tới.,83,,0,3,3,Nhường đường cho xe đi trên đường ưu tiên hoặc đường chính từ bất kỳ hướng nào tới.,False,giao thông,False,False
108,"Biển nào cấm tất cả các loại xe cơ giới và thô sơ đi lại trên đường, trừ xe ưu tiên theo luật định (nếu đường vẫn cho xe chạy được)?",132,Biển 1.,7,Biển 2.,7,Cả hai biển.,12,,0,3,1,Biển 1.,False,biển,True,False
109,Biển số 1 có ý nghĩa như thế nào?,33,Biển chỉ dẫn hết cấm đỗ xe theo giờ trong khu vực.,50,Biển chỉ dẫn hết hiệu lực khu vực đỗ xe trên các tuyến đường đối ngoại.,71,Biển chỉ dẫn khu vực đỗ xe trên các tuyến đường đối ngoại.,58,,0,3,1,Biển chỉ dẫn hết cấm đỗ xe theo giờ trong khu vực.,False,biển,False,False
110,"Khi gặp xe buýt đang dừng đón, trả khách, người điều khiển xe mô tô phải xử lý như thế nào dưới đây?",100,Tăng tốc độ để nhanh chóng vượt qua xe buýt.,44,"Quan sát, giảm tốc độ đi qua xe buýt hoặc dừng lại để bảo đảm an toàn.",70,Cả hai ý trên.,14,,0,3,2,"Quan sát, giảm tốc độ đi qua xe buýt hoặc dừng lại để bảo đảm an toàn.",False,xe mô tô,False,True
111,"Tại nơi đường giao nhau, khi đèn điều khiển giao thông có tín hiệu màu vàng, người điều khiển phương tiện tham gia giao thông phải chấp hành như thế nào là đúng quy tắc giao thông?",180,"Dừng lại trước vạch dừng; trường hợp đang đi trên vạch dừng hoặc đã đi qua vạch dừng mà tín hiệu đèn màu vàng thì được đi tiếp; trường hợp tín hiệu đèn màu vàng nhấp nháy, người điều khiển phương tiện tham gia giao thông đường bộ được đi nhưng phải quan sát, giảm tốc độ hoặc dừng lại nhường đường cho người đi bộ, xe lăn của người khuyết tật qua đường hoặc các phương tiện khác.",379,Tăng tốc độ nhanh chóng vượt qua nút giao.,42,"Quan sát, giảm tốc độ, từ từ vượt qua nút giao.",47,,0,3,1,"Dừng lại trước vạch dừng; trường hợp đang đi trên vạch dừng hoặc đã đi qua vạch dừng mà tín hiệu đèn màu vàng thì được đi tiếp; trường hợp tín hiệu đèn màu vàng nhấp nháy, người điều khiển phương tiện tham gia giao thông đường bộ được đi nhưng phải quan sát, giảm tốc độ hoặc dừng lại nhường đường cho người đi bộ, xe lăn của người khuyết tật qua đường hoặc các phương tiện khác.",False,giao thông,False,True
112,Xe nào dừng đúng theo quy tắc giao thông?,41,Xe con.,7,Xe mô tô.,9,Cả 2 xe đều đúng.,20,,0,3,1,Xe con.,False,giao thông,False,False
113,"Biển nào chỉ đường dành cho người đi bộ, các loại xe không được đi vào khi gặp biển này?",88,Biển 1.,7,Biển 1 và 3.,12,Biển 3.,7,Cả ba biển.,13,4,3,Biển 3.,False,biển,True,False
114,Người được chở trên xe mô tô có được kéo theo người đang điều khiển xe đạp hay không?,85,Chỉ được phép nếu cả hai đội mũ bảo hiểm.,41,Không được phép.,16,Chỉ được thực hiện trên đường vắng.,35,,0,3,2,Không được phép.,False,xe mô tô,False,False
